{
  "api_endpoint": "https://YOUR_API_HOST/YOUR_API_PREFIX",
  "api_key": "REPLACE_WITH_YOUR_API_KEY",
  "profile": "openai-responses",
  "orchestration_model": "YOUR_EXACT_ORCHESTRATION_MODEL_ID",
  "models": [
    {
      "id": "YOUR_EXACT_IMAGE_MODEL_ID",
      "name": "My image model",
      "output_format": "png",
      "size": "1024x1024",
      "quality": "medium"
    }
  ]
}
